<?xml version="1.0" encoding="UTF-8"?>
<Zahtev xmlns="http://tim.robot/zahtev_za_sertifikat"
 xmlns:xsi="http://www.w3.org/2001/XMLSchema-instance"
 xsi:schemaLocation="http://tim.robot/zahtev_za_sertifikat zahtev_za_sertifikat.xsd">
    <Podaci_o_podnosiocu>
        <Ime>Nikola</Ime>
        <Prezime>Nikolic</Prezime>
        <Datum_rodjenja>1995-05-04</Datum_rodjenja>
        <Pol>Musko</Pol>
        <JMBG>0405995666666</JMBG>
        <Broj_pasosa>012345678</Broj_pasosa>
    </Podaci_o_podnosiocu>
    <Razlog_za_podnosenje>Putovanje</Razlog_za_podnosenje>
    <Mesto>Novi Sad</Mesto>
    <Datum>2021-05-04</Datum>
</Zahtev>
